{
  "$schema": "https://json-schema.org/draft/2020-12/schema",
  "$id": "https://workout-player.pages.dev/schemas/workout-playback.json",
  "title": "Workout Playback Format",
  "description": "Format for workouts that the player app consumes",
  "type": "object",
  "required": ["version", "title", "steps"],
  "properties": {
    "version": {
      "type": "number",
      "const": 1,
      "description": "Schema version (must be 1)"
    },
    "title": {
      "type": "string",
      "minLength": 1,
      "description": "Workout title"
    },
    "description": {
      "type": "string",
      "description": "Optional workout description"
    },
    "equipment": {
      "type": "array",
      "items": {
        "type": "string"
      },
      "description": "Equipment needed for the workout"
    },
    "skipLastRest": {
      "type": "boolean",
      "description": "Skip the last rest step at the end of the workout"
    },
    "steps": {
      "type": "array",
      "minItems": 1,
      "items": {
        "$ref": "#/$defs/step"
      },
      "description": "Array of workout steps"
    }
  },
  "$defs": {
    "step": {
      "oneOf": [
        { "$ref": "#/$defs/timerStep" },
        { "$ref": "#/$defs/repsStep" },
        { "$ref": "#/$defs/groupStep" }
      ]
    },
    "timerStep": {
      "type": "object",
      "required": ["id", "type", "name", "durationSeconds"],
      "properties": {
        "id": {
          "type": "string",
          "description": "Unique step identifier"
        },
        "type": {
          "const": "timer"
        },
        "name": {
          "type": "string",
          "minLength": 1,
          "description": "Step name (e.g., Warm up, Rest)"
        },
        "durationSeconds": {
          "type": "number",
          "minimum": 1,
          "description": "Duration in seconds"
        },
        "rest": {
          "type": "boolean",
          "description": "Mark as rest for skipLastRest logic"
        },
        "notes": {
          "type": "string",
          "description": "Optional coaching cues or notes"
        }
      }
    },
    "repsStep": {
      "type": "object",
      "required": ["id", "type", "name", "reps"],
      "properties": {
        "id": {
          "type": "string",
          "description": "Unique step identifier"
        },
        "type": {
          "const": "reps"
        },
        "name": {
          "type": "string",
          "minLength": 1,
          "description": "Exercise name (e.g., Push-ups, Squats)"
        },
        "reps": {
          "type": "number",
          "minimum": 1,
          "description": "Number of repetitions"
        },
        "notes": {
          "type": "string",
          "description": "Optional coaching cues or notes"
        }
      }
    },
    "groupStep": {
      "type": "object",
      "required": ["id", "type", "name", "rounds", "steps"],
      "properties": {
        "id": {
          "type": "string",
          "description": "Unique step identifier"
        },
        "type": {
          "const": "group"
        },
        "name": {
          "type": "string",
          "minLength": 1,
          "description": "Group name (e.g., Circuit 1)"
        },
        "rounds": {
          "type": "number",
          "minimum": 1,
          "description": "Number of rounds to repeat"
        },
        "skipLastRest": {
          "type": "boolean",
          "description": "Skip the last rest step in each round"
        },
        "steps": {
          "type": "array",
          "minItems": 1,
          "items": {
            "$ref": "#/$defs/step"
          },
          "description": "Steps to repeat for each round"
        },
        "notes": {
          "type": "string",
          "description": "Optional notes about the group"
        }
      }
    }
  }
}
